<?xml version="1.0" encoding="utf-8"?>
<!DOCTYPE extension SYSTEM "../../tao/doc/structures.dtd">
<structures>
	<structure id="delivery" name="Deliveries" level="4" visible="true">
		<description>Prepare, publish deliveries sessions.</description>
		<sections>
			<section id="manage_deliveries" name="Manage deliveries" url="/taoDelivery/Delivery/index">
				<trees>
					<tree name="Deliveries library"
						className="Delivery"
						dataUrl="/taoDelivery/Delivery/getDeliveries"
						editClassUrl="/taoDelivery/Delivery/editDeliveryClass"
						editInstanceUrl="/taoDelivery/Delivery/editDelivery"
						addInstanceUrl="/taoDelivery/Delivery/addDelivery"
						addSubClassUrl="/taoDelivery/Delivery/addDeliveryClass"
						deleteUrl="/taoDelivery/Delivery/delete"
						duplicateUrl="/taoDelivery/Delivery/cloneDelivery"
						moveInstanceUrl="/taoDelivery/Delivery/moveInstance"
					/>
				</trees>
				<actions>
					<action name="search" url="/taoDelivery/Delivery/search" context="*" />
					<action name="new class" js="generisActions.subClass" url="/taoDelivery/Delivery/addDeliveryClass" context="class" />
					<action name="new delivery" js="generisActions.instanciate" url="/taoDelivery/Delivery/addDelivery" context="class" />
					<action name="delete" js="generisActions.removeNode" url="/taoDelivery/Delivery/delete" context="resource" />
					<action name="duplicate" js="generisActions.duplicateNode" url="/taoDelivery/Delivery/cloneDelivery" context="instance" />
					<action name="move" js="generisActions.moveNode" url="" context="instance" />
					<action name="export" url="/tao/Export/index"  context="*" />
					<action name="import" url="/tao/Import/index"  context="class" />
					<action name="LTI export" url="/ltiDeliveryProvider/DeliveryLinks/index" context="instance" />
				</actions>
			</section>

		<section id="manage_resultservers" name="Manage result servers" url="/taoDelivery/ResultServer/index">
				<trees>
					<tree name="Result Servers library"
						className="Result Server"
						dataUrl="/taoDelivery/ResultServer/getResultServers"
						editClassUrl="/taoDelivery/ResultServer/editResultServerClass"
						editInstanceUrl="/taoDelivery/ResultServer/editResultServer"
						addInstanceUrl="/taoDelivery/ResultServer/addResultServer"
						addSubClassUrl="/taoDelivery/ResultServer/addResultServerClass"
						deleteUrl="/taoDelivery/ResultServer/delete"
						duplicateUrl="/taoDelivery/ResultServer/cloneInstance"
						moveInstanceUrl="/taoDelivery/ResultServer/moveInstance"
					/>
				</trees>
				<actions>
					<action name="search" url="/taoDelivery/ResultServer/search" context="*" />
					<action name="new class" js="generisActions.subClass" url="/taoDelivery/ResultServer/addResultServerClass" context="class" />
					<action name="new result server" js="generisActions.instanciate" url="/taoDelivery/ResultServer/addResultServer" context="class" />
					<action name="delete" js="generisActions.removeNode" url="/taoDelivery/ResultServer/delete" context="resource" />
					<action name="duplicate" js="generisActions.duplicateNode" url="/taoDelivery/ResultServer/cloneInstance" context="instance" />
					<action name="move" js="generisActions.moveNode" url="" context="instance" />
					<action name="export" url="/tao/Export/index"  context="*" />
					<action name="import" url="/tao/Import/index"  context="class" />
				</actions>
			</section>

		</sections>
	</structure>
</structures>