<?xml version="1.0" encoding="utf-8"?>
<!DOCTYPE extension SYSTEM "../doc/structures.dtd">
<structures>
	<structure id="users" name="Users" level="8" visible="false">
		<description />
		<sections>
			<section id="list_users" name="Manage users" url="/tao/Users/index" />
			<section id="add_user" name="Add a user" url="/tao/Users/add" />
			<section id="edit_user" name="Edit a user" url="/tao/Users/edit" />
			<section id="manage_acl" name="Manage ACL" url="/tao/Acl/index" />
		</sections>
	</structure>
	<structure id="settings" name="Settings" level="11" visible="false">
		<description />
		<sections>
			<section id="settings_my_settings" name="My settings" url="/tao/UserSettings/properties" />
			<section id="settings_my_password" name="Change password" url="/tao/UserSettings/password" />
			<section id="settings_optimisation" name="TAO optimizer" url="/tao/Settings/index" />
			<section id="settings_versioning" name="Revision control" url="/tao/SettingsVersioning/index">
				<trees>
					<tree name="Repositories"
						className="Repository"
						dataUrl="/tao/SettingsVersioning/getOntologyData"
						editClassUrl="/tao/SettingsVersioning/index"
						editInstanceUrl="/tao/SettingsVersioning/editRepository"
						addInstanceUrl="/tao/SettingsVersioning/addInstance"
						deleteUrl="/tao/SettingsVersioning/delete"
					/>
				</trees>
				<actions>
					<action name="add repository" js="generisActions.instanciate" url="/tao/SettingsVersioning/addInstance" context="class" />
					<action name="remove repository" js="generisActions.removeNode" url="/tao/SettingsVersioning/delete" context="instance" />
				</actions>
			</section>
			<section id="settings_ext_mng" name="Extensions manager" url="/tao/ExtensionsManager/index" />
		</sections>
	</structure>
</structures>