<?xml version="1.0" encoding="utf-8"?>
<!DOCTYPE extension SYSTEM "../../tao/doc/structures.dtd">
<structures>
	<structure id="settings" name="Settings" level="11" visible="false">
		<description />
		<sections>
			<section id="settings_oauth_mng" name="LTI Consumers" url="/taoLti/ConsumerAdmin/index">
				<trees>
					<tree name="LTI Consumers"
						className="LTI Consumers"
						dataUrl="/taoLti/ConsumerAdmin/getOntologyData"
						editInstanceUrl="/taoLti/ConsumerAdmin/editInstance"
						addInstanceUrl="/taoLti/ConsumerAdmin/addInstance"
						deleteUrl="/taoLti/ConsumerAdmin/delete"
					/>
				</trees>
				<actions>
					<action name="add Consumer" url="/taoLti/ConsumerAdmin/addInstanceForm" context="class" />
					<action name="delete" js="removeNode" url="/taoLti/ConsumerAdmin/delete" context="instance" />
					<action name="export" url="/tao/Export/index"  context="resource" />
					<action name="import" url="/tao/Import/index"  context="class" />					
				</actions>
			</section>
		</sections>
	</structure>
</structures>