<?xml version="1.0" encoding="utf-8"?>
<!DOCTYPE extension SYSTEM "../../tao/doc/structures.dtd">
<structures>
    <structure id="resultserver" name="Result Server" visible="true">
		<description>Manage Result Servers</description>
    <sections>
    <section id="manage_resultservers" name="Manage result servers" url="/taoResultServer/ResultServer/index">
				<trees>
					<tree name="Result Servers library"
						className="Result Server"
						dataUrl="/taoResultServer/ResultServer/getResultServers"
						editClassUrl="/taoResultServer/ResultServer/editResultServerClass"
						editInstanceUrl="/taoResultServer/ResultServer/editResultServer"
						addInstanceUrl="/taoResultServer/ResultServer/addResultServer"
						addSubClassUrl="/taoResultServer/ResultServer/addResultServerClass"
						deleteUrl="/taoResultServer/ResultServer/delete"
						duplicateUrl="/taoResultServer/ResultServer/cloneInstance"
						moveInstanceUrl="/taoResultServer/ResultServer/moveInstance"
					/>
				</trees>
				<actions>
					<action name="search" url="/taoResultServer/ResultServer/search" context="*" />
					<action name="new class" js="generisActions.subClass" url="/taoResultServer/ResultServer/addResultServerClass" context="class" />
					<action name="new result server" js="generisActions.instanciate" url="/taoResultServer/ResultServer/addResultServer" context="class" />
					<action name="delete" js="generisActions.removeNode" url="/taoResultServer/ResultServer/delete" context="resource" />
					<action name="duplicate" js="generisActions.duplicateNode" url="/taoResultServer/ResultServer/cloneInstance" context="instance" />
					<action name="move" js="generisActions.moveNode" url="" context="instance" />
					<action name="export" url="/tao/Export/index"  context="*" />
					<action name="import" url="/tao/Import/index"  context="class" />
				</actions>
			</section>
     </sections>
    </structure>
</structures>